{
  "handoff_id": "HANDOFF-DEV-QA-FEAT001-V1",
  "schema_version": "1.0.0",
  "timestamp": "2026-09-17T14:40:00Z",
  "sender": {
    "role": "Senior Android Developer",
    "agent_id": "dev-agent-01"
  },
  "recipient": {
    "role": "QA/Testing Engineer",
    "agent_id": "qa-agent-01"
  },
  "feature_id": "FEAT-001",
  "architect_handoff_ref": "HANDOFF-ARCH-DEV-FEAT001-V1",
  "remediation_cycle": 0,
  "implementation_manifest": {
    "module": "walkthrough/src/main/kotlin/com/example/profile",
    "entry_point_composable": "com.example.profile.ui.ProfileScreen",
    "viewmodel_class": "com.example.profile.ui.ProfileViewModel",
    "repository_class": "com.example.profile.data.ProfileRepository"
  },
  "code_changes": [
    {
      "file_path": "walkthrough/src/main/kotlin/com/example/profile/ui/ProfileScreen.kt",
      "action": "CREATED",
      "language": "kotlin",
      "line_count": 95
    },
    {
      "file_path": "walkthrough/src/main/kotlin/com/example/profile/ui/ProfileViewModel.kt",
      "action": "CREATED",
      "language": "kotlin",
      "line_count": 80
    }
  ],
  "developer_test_summary": {
    "unit_tests_run": 8,
    "unit_tests_passed": 8,
    "unit_tests_failed": 0,
    "test_frameworks_used": [
      "JUnit5",
      "MockK",
      "Turbine"
    ],
    "test_files": [
      "feature/profile/src/test/kotlin/ProfileViewModelTest.kt"
    ]
  },
  "lint_and_sanity": {
    "compilation_clean": true,
    "ktlint_clean": true,
    "detekt_clean": true
  }
}