{
  "handoff_id": "HANDOFF-DEV-QA-FEAT-005",
  "schema_version": "1.0.0",
  "timestamp": "2026-09-24T09:27:00Z",
  "sender": {
    "role": "Senior Android Developer",
    "agent_id": "senior_android_developer"
  },
  "recipient": {
    "role": "QA/Testing Engineer",
    "agent_id": "qa_testing_engineer"
  },
  "feature_id": "FEAT-005",
  "architect_handoff_ref": "HANDOFF-ARCH-DEV-FEAT-005",
  "remediation_cycle": 0,
  "implementation_manifest": {
    "module": ":feature:overview",
    "entry_point_composable": "OverviewScreen",
    "viewmodel_class": "es.joshluq.kmsafe.feature.overview.OverviewViewModel",
    "repository_class": "es.joshluq.kmsafe.infrastructure.repository.NotificationRepositoryImpl"
  },
  "code_changes": [
    {
      "file_path": "core/domain/src/main/java/es/joshluq/kmsafe/domain/usecase/PublishNotificationIfUnreadUseCase.kt",
      "action": "CREATED",
      "language": "kotlin",
      "line_count": 22
    },
    {
      "file_path": "core/domain/src/main/java/es/joshluq/kmsafe/domain/model/UserPreferences.kt",
      "action": "MODIFIED",
      "language": "kotlin",
      "line_count": 16
    },
    {
      "file_path": "core/domain/src/main/java/es/joshluq/kmsafe/domain/repository/PreferencesRepository.kt",
      "action": "MODIFIED",
      "language": "kotlin",
      "line_count": 50
    },
    {
      "file_path": "core/domain/src/main/java/es/joshluq/kmsafe/domain/usecase/UpdatePreferencesUseCase.kt",
      "action": "MODIFIED",
      "language": "kotlin",
      "line_count": 67
    },
    {
      "file_path": "core/infrastructure/src/main/java/es/joshluq/kmsafe/infrastructure/usecase/PublishNotificationIfUnreadUseCaseImpl.kt",
      "action": "CREATED",
      "language": "kotlin",
      "line_count": 32
    },
    {
      "file_path": "core/infrastructure/src/main/java/es/joshluq/kmsafe/infrastructure/di/UseCaseModule.kt",
      "action": "MODIFIED",
      "language": "kotlin",
      "line_count": 431
    },
    {
      "file_path": "core/infrastructure/src/main/java/es/joshluq/kmsafe/infrastructure/local/datasource/PreferencesDataSource.kt",
      "action": "MODIFIED",
      "language": "kotlin",
      "line_count": 124
    },
    {
      "file_path": "core/infrastructure/src/main/java/es/joshluq/kmsafe/infrastructure/repository/PreferencesRepositoryImpl.kt",
      "action": "MODIFIED",
      "language": "kotlin",
      "line_count": 50
    },
    {
      "file_path": "feature/notifications/src/main/java/es/joshluq/kmsafe/feature/notifications/components/NotificationPill.kt",
      "action": "MODIFIED",
      "language": "kotlin",
      "line_count": 165
    },
    {
      "file_path": "feature/overview/src/main/java/es/joshluq/kmsafe/feature/overview/Contract.kt",
      "action": "MODIFIED",
      "language": "kotlin",
      "line_count": 133
    },
    {
      "file_path": "feature/overview/src/main/java/es/joshluq/kmsafe/feature/overview/OverviewScreen.kt",
      "action": "MODIFIED",
      "language": "kotlin",
      "line_count": 1045
    },
    {
      "file_path": "feature/overview/src/main/java/es/joshluq/kmsafe/feature/overview/OverviewViewModel.kt",
      "action": "MODIFIED",
      "language": "kotlin",
      "line_count": 701
    },
    {
      "file_path": "feature/profile/src/main/java/es/joshluq/kmsafe/feature/profile/preferences/Contract.kt",
      "action": "MODIFIED",
      "language": "kotlin",
      "line_count": 42
    },
    {
      "file_path": "feature/profile/src/main/java/es/joshluq/kmsafe/feature/profile/preferences/PreferencesScreen.kt",
      "action": "MODIFIED",
      "language": "kotlin",
      "line_count": 538
    },
    {
      "file_path": "feature/profile/src/main/java/es/joshluq/kmsafe/feature/profile/preferences/PreferencesViewModel.kt",
      "action": "MODIFIED",
      "language": "kotlin",
      "line_count": 198
    }
  ],
  "developer_test_summary": {
    "unit_tests_run": 35,
    "unit_tests_passed": 35,
    "unit_tests_failed": 0,
    "test_frameworks_used": [
      "JUnit4",
      "MockK",
      "Turbine",
      "kotlinx-coroutines-test"
    ],
    "test_files": [
      "core/infrastructure/src/test/kotlin/es/joshluq/kmsafe/infrastructure/usecase/PublishNotificationIfUnreadUseCaseImplTest.kt",
      "feature/overview/src/test/kotlin/es/joshluq/kmsafe/feature/overview/OverviewViewModelTest.kt",
      "core/domain/src/test/kotlin/es/joshluq/kmsafe/domain/usecase/UpdatePreferencesUseCaseTest.kt",
      "feature/profile/src/test/kotlin/es/joshluq/kmsafe/feature/profile/preferences/PreferencesViewModelTest.kt"
    ]
  },
  "lint_and_sanity": {
    "compilation_clean": true,
    "ktlint_clean": true,
    "detekt_clean": true
  }
}
