{
  "handoff_id": "HANDOFF-DEV-QA-FEAT-006",
  "schema_version": "1.0.0",
  "timestamp": "2026-09-24T10:10:00Z",
  "sender": {
    "role": "Senior Android Developer",
    "agent_id": "senior_android_developer"
  },
  "recipient": {
    "role": "QA/Testing Engineer",
    "agent_id": "qa_testing_engineer"
  },
  "feature_id": "FEAT-006",
  "architect_handoff_ref": "HANDOFF-ARCH-DEV-FEAT-006",
  "remediation_cycle": 0,
  "implementation_manifest": {
    "module": ":feature:overview",
    "entry_point_composable": "OverviewScreen",
    "viewmodel_class": "OverviewViewModel",
    "repository_class": "NotificationRepositoryImpl"
  },
  "code_changes": [
    {
      "file_path": "feature/overview/src/main/java/es/joshluq/kmsafe/feature/overview/OverviewViewModel.kt",
      "action": "MODIFIED",
      "language": "kotlin",
      "line_count": 703
    },
    {
      "file_path": "core/infrastructure/src/main/java/es/joshluq/kmsafe/infrastructure/repository/NotificationRepositoryImpl.kt",
      "action": "MODIFIED",
      "language": "kotlin",
      "line_count": 201
    }
  ],
  "developer_test_summary": {
    "unit_tests_run": 35,
    "unit_tests_passed": 35,
    "unit_tests_failed": 0,
    "test_frameworks_used": [
      "JUnit4",
      "MockK",
      "Turbine",
      "kotlinx-coroutines-test"
    ],
    "test_files": [
      "feature/overview/src/test/kotlin/es/joshluq/kmsafe/feature/overview/OverviewViewModelTest.kt",
      "core/infrastructure/src/test/kotlin/es/joshluq/kmsafe/infrastructure/repository/NotificationRepositoryImplTest.kt"
    ]
  },
  "lint_and_sanity": {
    "compilation_clean": true,
    "ktlint_clean": true,
    "detekt_clean": true
  }
}
